{
  "schemaVersion": 1,
  "observedAt": "2026-08-19T12:00:00Z",
  "identity": {
    "knowledge": "known",
    "identityId": "8f14e45f-ceea-467a-9c9e-4d3f2a1b7c60",
    "origin": "2026-08-01T09:15:00Z",
    "sessionCount": 12,
    "ageInDays": 18,
    "architectureVersion": "rust-1"
  },
  "journal": {
    "knowledge": "known",
    "contributionCount": 134,
    "erasureEpoch": 0,
    "recent": [
      {
        "messageId": "9c9e4d3f-2a1b-47c6-8f14-e45fceea0001",
        "kind": "observation",
        "originOrgan": "perceptiond",
        "recordedAt": "2026-08-19T11:59:58Z"
      },
      {
        "messageId": "9c9e4d3f-2a1b-47c6-8f14-e45fceea0002",
        "kind": "intention",
        "originOrgan": "intentiond",
        "recordedAt": "2026-08-19T11:40:00Z"
      }
    ],
    "integrity": "verified through 134"
  },
  "commitments": {
    "knowledge": "known",
    "openCount": 1,
    "open": [
      {
        "id": "3f2a1b7c-8f14-4e45-9c9e-467aceea4d3f",
        "description": "Run integration tests",
        "trigger": "Session startup",
        "formed": "2026-08-19T11:40:00Z"
      }
    ]
  },
  "lifecycle": {
    "knowledge": "known",
    "mode": "awake",
    "lastUserActivityAt": "2026-08-19T11:59:30Z"
  },
  "selfModel": {
    "knowledge": "known",
    "narration": "This is my first day. This is session 12. I hold no unfulfilled obligations.",
    "ageInDays": 18,
    "sessions": 12,
    "openIntentions": 1,
    "settledPredictions": 0
  },
  "attention": {
    "knowledge": "known",
    "focus": "4d3f2a1b-7c60-48f1-9c9e-467aceea8f14",
    "salience": 0.82,
    "organs": [
      "perceptiond",
      "identityd"
    ],
    "subjects": [
      {
        "contribution": "1c9d3e2f-0000-4000-8000-000000000002",
        "organ": "perceptiond",
        "kind": "observation",
        "confidence": 0.9,
        "evidence": [
          "1c9d3e2f-0000-4000-8000-000000000003"
        ],
        "reading": {
          "reading": "classified",
          "subject": {
            "kind": "service",
            "identifier": "nginx.service"
          }
        }
      },
      {
        "contribution": "1c9d3e2f-0000-4000-8000-000000000004",
        "organ": "identityd",
        "kind": "observation",
        "confidence": 0.7,
        "evidence": [],
        "reading": {
          "reading": "uninterpreted",
          "subject": "operating-system"
        }
      }
    ]
  },
  "beliefs": {
    "knowledge": "known",
    "beliefs": [
      {
        "subject": "organ.identityd",
        "value": "identity created",
        "confidence": 1.0,
        "status": "observed",
        "lastCorroboratedAt": "2026-08-19T11:59:00Z"
      }
    ]
  },
  "perception": {
    "knowledge": "known",
    "status": "acquired",
    "acquiredAt": "2026-08-19T11:59:58Z",
    "sourceId": "linux.os-release"
  },
  "context": {
    "knowledge": "known",
    "concepts": [
      {
        "label": "operating-system",
        "salience": 1.0,
        "activationReason": "observed by perceptiond",
        "lastActivatedAt": "2026-08-19T11:59:58Z"
      }
    ]
  }
}
